name,line
Rouge,You just look so much alike!
Silver,"You know, maybe things aren't so bad."
Silver,"I'm here, I got the nice ocean breeze."
Silver,Just alone with my thoughts.
Blaze,Hey Silver.
Silver,GODDAMNIT!
Blaze,"What, what's wrong?"
Silver,"Oh, nothing."
Silver,"Hi, Blaze. How are you?"
Blaze,I can tell you want some alone time.
Silver,"I do, but I also feel like I'm just gonna be alone longer than I want if I leave now, so let's go."
Silver,After I—move my lips a bit more.
Silver,"Y'know, Blaze, do you ever stop and think about how—"
Silver,This is really— Blaze: All the time.
Blaze,"All the time, Silver. I can never stop thinking."
Blaze,Sends me into a fit.
Blaze,"Always analyzing, always so superior to everyone around me. Just—"
Blaze,"I know so much, Silver. My brain is too good for this world."
Silver,"Oh, we're in the snow, now. Hey, look, it's a blue!"
Blaze,"Ah, yes, my echolocation located the emerald. As I suspected."
Blaze,I am superior once again.
Blaze,Sliver? We have work to do. Come with me.
Silver,"Awh, I wish I was as cool as you."
Sonic,"This place is so hot! Rouge: Knuckles, why the fuck do you have Legos on your shoes?"
Knuckles,YOU HAD THE WEED THE WHOLE TIME?!
Shadow,YOU INTERRUPTED MY BROODING—
Rouge,"Listen. I have the weed, and I have what you want, so give us what we want."
Knuckles,I need it for my concussion.
Sonic,"Okay, so hand it over! Knuckles: You can't keep my medicine away from me!"
Rouge,"No, you can't have it until you give us what we asked for— Knuckles: YOU CAN'T STOP OUR LOVE."
Rouge,What? (Alfred laughing)
Shadow,"Alright, so this is just getting into crack ship territory."
Sonic,"Okay, OBVIOUSLY this is a sore point."
Tails,"We need to go over there, and just like—fucking chill the fuck out. Everyone is so tense!"
Rouge,"Alright, so we found another— Shadow: HEY, DON'T—!"
Rouge,WHOA! Shadow: What did I JUST say?!
Sonic,Smells like pancakes!
Amy,"Sneaking, sneaking / Into the music studio"
Amy,"Sneaking into Sonic's album!~ Robots: Fuck, do I hear somethin'? I can't hear anything."
Robots,"Hey, have you started on your new single yet?"
Amy,That's his band! Wow.
Amy,I need to sneak inside the— Elise: Oh!
Amy,"Shit! Elise: Yeah—right back at ya, friend!"
Amy,What are you doing here? Elise: Uh...
Amy,"Aw, shit, what did you do?! What did you do to the album?!"
Elise,"I—I just— sneaked! (Robot noises, alarms)"
Elise,"I snea--okay! Amy: Did you leak the album? Goddammit! (Robot noises, alarms)"
Memphis,"Ah, it's so nice to be outside. Blaze: Sucks to be outside. Silver: Yeah."
Silver,"I—I agree with Blaze. You know, this was kind of nice at first, but now I'm all congested—my eyes hurt."
Memphis,"You know, I haven't been in the presence of a fair maiden in... many a year..."
Memphis,"Blaze, it's so nice to be with you. And you—you BETA ORBITER MALE—I can do without you."
Memphis,"But you make me feel stronger and smarter because you're here, so you can stay for now. Silver: Awh..."
Memphis,"Yes, I can feel myself becoming more powerful with all of your insolent little whines."
Memphis,"(Chase laughing, breaking character) I'm gonna do a little dance."
Amy,"So, let me get this straight."
Amy,"You've been—dating... Sonic? The Hedgehog? The blue one, looks like this?"
Elise,"Well—I guess? If that's my story arc, then yes!"
Amy,Yup! I can kill ya!
Amy,"I'll rip your fuckin' throat out, wear it as a fuckin' necktie! (laughter continues)"
Elise,"Oh—Okay? I have no idea what the words you just said mean, but I'm glad we're outside. It's been like—"
Elise,a week. I've lost track of time—I'm not sure if I'm a person.
Amy,"Hmm, you won't be—in just a second!~"
Amy,"So, tell me. Do you enjoy... rocks? In your stomach? Hahaha, that's a fitting punishment, I think, for stealing my boyfriend!"
Amy,"I'll fill your stomach with rocks, twinkle twinkle!"
Elise,"Actually, that's all I've been eating for the past three days."
Amy,You've been eating rocks? You're immune. Dammit!
Amy,"Alright, well how about—I run around like this, and then scare you 'til your heart stops!"
Amy,Boo! YEAAAGH!
Amy,I'm scary!
Amy,"Aw, fuck it, I can't compete."
Amy,"You have—skin, and—hands—that are like, small, and dainty, and can fit in a butthole!"
Sonic,"And she has skin and hands that are small and dainty and can fit in a butthole. She's the girl of my dreams, Shadow!"
Shadow,I have one of those too. He's very very nice.
Shadow,ZA WARUDO!
Rouge,You may now kiss the bride.
Shadow,"Wait, Sonic, which of us is the bride? Sonic!"
Knuckles,"Wait, agh, shit. Shadow: SONIC, I NEED AN ANSWER!"
Rouge,"Come on, Shadow, it's time for the reception."
Shadow,"No, I don't know which one of us is the bride, and that's kind of like a thing for—oh, God."
Memphis,"Go on, Shadow, don't you support gay rights?"
Shadow,I do!
Memphis,"Look at this weird flame in front of me, it's REALLY BIG!"
Shadow,Oh! Memphis: Doesn't that intimidate you?!
Shadow,"Sorry, I had you confused for Sonic. I thought WE were getting married, Mee-philes."
Memphis,"Come kiss me, boy!"
Sonic,Oh! Alright! Knuckles: FUCK my ass.
Sonic,Where's that sweet cake?
Knuckles,"My brain again. Tails: We made it, we're back!"
Sonic,"Tails, did you forget to decorate the pavilion? Tails: No! I--I wasn't in charge of decorations."
Sonic,"Oh my god, of course."
Sonic,"Oh, the invitation! You didn't hand it out!"
Knuckles,I put it on the ground as a decoration. Sonic: To the best wedding of the century!
Tails,"Congratulations, Sonic! Sonic: Oh my god."
Knuckles,"Wait, but you got married in the future. Sonic: No."
Robots,Hello. Hello. Can I have your number? Penny: (wheezing) Are you kidding me?!
Robots,Beep. Borp. Instant ramen. Beep. Borp. Robot noises. Anyone here got weed?
Eggman,"You thought you could get away, gamer girl. You thought that you could fuckin' escape me, gamer girl."
Eggman,But my IQ is too HIGH!
Omega,It looks like that I am trapped in the middle of a forest as Alpha and Omega 3.
Omega,No one else is going to be out here to save me so I must get away immediately.
Rouge,"Well, Hel~lo, nurse!"
Omega,"Who is this gross bat specimen trying to talk to me? Get away from me, thotticus."
Rouge,"Hi! You are quite a hunk of metal, aren't you?"
Omega,And you're quite one-polygon titted.
Rouge,"Here, you want some weed? Omega: I do not have lungs. So I cannot smoke weed."
Omega,But I will take it anyway. And put it directly into my braincells. Here we go.
Omega,HOOOOOLYYYY SHIIIIIIIIIIIIII
Omega,IIIIIIIIIIIIIIIIIIIIIIIIIIIIIIIIIIIIIIIII (cast laughing)
Omega,"IIIIIIIIIIIIIIIIIIIIIIIIIIIIIIIIIIIIIIIII Ryan: Keep holding it, keep holding it, keep holding it!"
Omega,IIIIIIIIIIIIIIIIIIIIIIIIIIIIIIIIIIIIIIIIIT Ryan: Keep holding it! Yes!
Omega,(inhales) WOw.
Hayley,"Oh, fuck me running. Rouge: How does it feel? Are you enjoyin' it?"
Omega,What planet am I on? What's today? My braincell: Destroyed. My wig is gone.
Rouge,Buh-bye~!
Omega,I-- uh-- alright. I'll best be going now. No one will ever follow me with my knife hands.
Memphis,"(laughing) Hello there, Shadow the Hedgehog! It's so good to see you in my"
Memphis,new Fortnite map I'm developing.
Shadow,I was actually meaning to ask you a question:
Shadow,Are you seeing anyone right now? Because there's no one sexier than myself.
Memphis,(chuckles)
Memphis,"Why? Are you– are you interested because, um, I was actually thinking you and I are pretty similar."
Shadow,"Bruh, I wouldn't be asking if I wasn't interested. Memphis: Check out my– look at my cool shield."
Memphis,"It's made of 17,000 polygons and it's also–"
Memphis,"P-Purple and glowy which is your favorite color, I've been told."
Memphis,"Regardless, as I– as I said, previously, this is my new Fortnite map. I'm developing–"
Memphis,I'm developing it in this volcano and people will play it in real life.
Memphis,"If you die in the game, you die in real life, Shadow the Hedgehog."
Shadow,How did you know Sword Art Online was my favorite anime? You should have known that I had terrible taste.
Memphis,I know more about you than you could ever compreh– is that Sonic? How the fuck did he get here?
Memphis,What the fuck is he doing in my shield?
Memphis,"You know him, right? You guys are exes or something. Get him out of my fucking shield!"
Memphis,"If this relationship is going to work, you can't Shadow: No, don't you see?"
Memphis,"bring your exes. You know how uncomfortable that makes me, sweetie."
Memphis,Please. Let him– just go– make him go away.
Shadow,"Mephistopheles, please. I didn't know I was marrying him. I only thought it was you"
Shadow,because you look so similar.
Memphis,"My name is Memphis, Tennessee, and I will have you respect my name."
Memphis,"Here he is; he's still here. Why– why is he here? Like, how did he even get in there?"
Shadow,I don't know.
Shadow,Maybe we put a chicken bone in there or something and he just couldn't resist.
Memphis,He is that stupid. I'm glad we can still bond over how dumb your ex is.
Shadow,Ugh!
Shadow,That felt great.
Memphis,"I know exactly how you like it, baby. And now, check it out."
Memphis,This is my new Steven Universe Crystal Gem cosplay.
Shadow,"God. Omega: I need you to stop right now,"
Omega,for you are not a true gem. You are nothing but a fraud.
Memphis,Oh my god. (violent choking noises) What the fuck. Oh my god.
Memphis,I told you not to invite your asshole friends over and now I– I–
Shadow,I've never met this hunk of metal but I love him.
Memphis,I'm so fucking high right now. He's just here and I got secondhand smoke inebriated. I'm fucking leaving. I'm going back to my parents house until you get your asshole friends in order. Fuck you.
Shadow,Who the fuck are you?
Omega,"Shadow, wait, please don't–"
Omega,"Oh, god. Shadow I only came to admit my true feelings for you."
Shadow,Ah. A world where everyone loves me.
Omega,"It's everything about you. From your hot sauce hair, to your jet boots. Everything that you do is–"
Shadow,Mhm.
Omega,"Are you even listening to me, Shadow?"
Rouge,Hello~!
Shadow,Hey. Omega: Oh god. It's young thotticus once again.
Rouge,"Well, it is quite a pleasure to meet you here. Didn't expect you to be here, Shadow."
Shadow,"I didn't expect to be here either, but here you are with your–"
Omega,Fortnite: Battle Royale will be the biggest game of 2018 if we do not stop that giant.
Shadow,"Thank you, YouTube algorithm. Now go ahead and screw over some more creators."
Rouge,"Wait, Shadow!"
Shadow,"I said I'm going against YouTube now. That's– that's my character arc now, baby."
Omega,"You look like YouTube Red, why are you making fun of me."
Rouge,"Shadow, let me help you! Don't do this all by yourself. We were going to make"
Rouge,the best game together!
Rouge,(scoffs) We'd make such a good team.
Rouge,"Honestly, name a more iconic duo. Omega: Do you have any more weed?"
Shadow,"Little does she know, I hold the game file and–"
Eggman,"Mmm, the game is almost finished."
Shadow,"Hey Eggman, I found the computer room!"
Eggman,I'm actually Todd Howard now cuz I sell all the video games.
Shadow,"That's what they all say. Now quickly,"
Shadow,I need you to publish my game. Eggman: Shadow. You are my greatest creation of all
Eggman,time from the battle royale
Shadow,What? Eggman: and now look at you.
Shadow,"Wait, hold on. Are you my dad?"
Eggman,(chuckles) Where do you think you got all your characteristics?
Shadow,Of being an asshole? That would explain a lot.
Eggman,(chuckles) Look. The only thing I didn't give you is my realistic four penetrating nipples
Eggman,"Coming off my chest, Shadow. That's all you don't have. But when you do have is the battle."
Eggman,the experience to be a true Fortnite twink player.
Shadow,"Well, if you're my daddy, it makes the last dub horrifying. God."
Chase,"Okay."
Ryan,"Alright, cool."
Alfred,"Alright, okay. Welp."
Sonic,Elise! I'm so glad I saved you from that train!
Elise,"Oh, me too. It was so fast. I was so scared."
Sonic,I know. Woah!
Silver,"Hey, I saw you rescue Elise from that train. It was really cool. Can we be friends?"
Sonic,"Uh, no, I don't like you very much. You're weird."
Silver,Awwwh...
Silver,Now I'm sad! (Sonic screaming)
Silver,Take that!
Silver,uuh...
Silver,"This is what a cool does, right?"
Elise,How could you do this?
Eggman,Why don't you come with me again?
Sonic,No! Not again!
Shadow,"Hey. Oh, I haven't met you twink."
Silver,Wait.
Silver,You! You're the one!
Shadow,"Who did what? Wait, what'd I do? I mean, what didn't I do? I mean look at me. I'm so hot, ya know?"
Shadow,You made a rap so fire..
Sonic,"This doesn't change you leaving me at the altar! Wait, I guess it does, see ya!"
Shadow,Hey.
Silver,I'm gonna take you out to save the world!
Shadow,Good luck with that I have weed.
Shadow,See ya.
Silver,(whimpering in pain)
Shadow,Don't you know? Weed makes you fast. That's a factual thing.
Silver,What's a weed?
Shadow,"Oh my god, you can tell you're white..."
Shadow,"Anyway, I finished putting the game-- I sent it to Eggman. He's going to upload it soon."
Silver,No...
Silver,It's too late now. I can't go back in time again because... I can't go back in time again.
Silver,That's just it.
Silver,"But maybe this Blue will save the world, maybe? Here."
Shadow,"Woah, green! Silver: Blue!"
Shadow,What did we just do?
Shadow,Did we do that together? Was that like a gay thing?
Silver,It's always a gay thing. I thought that's just how it worked.. I'm gonna go.
Shadow,"God bless you Sonic Team. God bless you. Well, if you need to go, then go; I'm gonna chill out here and make sure that it gets picked up by some big successful game development company that'll be around for a long time like Blizzard."
Silver,I was talking about taking a shit.
Shadow,"What? Okay... go ahead. I don't know why you need a portal to take a shit,"
Shadow,"but, I mean, if you want to send your shit to the future, then..."
Shadow,Go ahead. I'm not judgmental. At all.
Silver,"Wait, no, don't go in that! That's the toilet!"
Eggman,"Now, you are going to play this game Elise, or else I'm going to push you off of this fucking--"
Elise,"I mean, I could jump. That could happen too."
Eggman,Or I could push you off of this polygon mountain.
Eggman,"Now, what is the choice Elise? You can either die, die, or--"
Sonic,No! Don't do either of those!
Elise,"Okay, I will do my own thing."
Elise,"Okay, I will do my own thing. Eggman: Go do it."
Sonic,No! Eggman: No Elise! I didn't mean it!
Sonic,Woah! You scared the hell outta me.
Eggman,Give me back my gamer girl Sonic!
Sonic,"She's my gamer girl now. Ain't that right, baby? Come with me. Thumbs up! Elise: Oh, my legs. They weak. My legs are weak."
Elise,"Yeah, good job. Good job, Sonic. I'm proud of you. Yeah, that was kind of scary. All right, let's-- let's bounce."
Sonic,"Oh, you want to play God of War?"
Sonic,Huh? Elise: Huh?
Sonic,Who's that?
Sonic,Instant ramen!
Robot,Find them. Find the gamer girl. We have to find the gamer girl.
Elise,"Oh yeah, the filter changed. It's great, isn't it?"
Sonic,I love Instagram. Let's go to Snapchat.
Elise,"It's amazing what natural sunlight in a filtered game will do, right?"
Sonic,"I know right? Like, you know, you just need that vitamin D."
Elise,My skin looks amazing now.
Elise,"Oh my god. Sonic: I know. Oh, do you exfoliate Elise?"
Elise,"Well, yes, I-I guess."
Sonic,That's my tree.
Elise,Oh my gosh. It's beautiful.
Elise,I wanna hug it. Can I hug your tree?
Elise,"Is that allowed? Do I have to ask permission? Sonic: Oh, well, I guess."
Sonic,"Just, you know, don't get too friendly with it."
Elise,"Okay, I promise. I'll keep my hands to myself then. I'll just put my hands back here and admire it from afar."
Sonic,"Well, you can't hug without hands Elise."
Sonic,Make up your damn mind!
Elise,"I did! I decided that cosplay wasn't consent, and I'm just gonna thank you for bringing me to your tree."
Elise,It's so wonderful. It's putting me in all the right moods.. of being.. happy.
Sonic,"Well, what are some of those moods? Huh?"
Elise,"Well happy is one, like I just said, and um..."
Elise,"Hungry. Hungry is a good mood. I've eaten nothing but rocks, as I've said, for a while."
Elise,Some plants would be a nice change to rocks.
Duke,My child. My baby girl. Don't worry.
Elise,Dad used to feed me plants.
Elise,It was nice.
Elise,I think I'm starting to hallucinate. It's been a while.
Elise,I just keep getting kidnapped.
Sonic,How about a hot dog? No additives.
Elise,That sounds wonderful. Um..
Elise,I'm gonna try not to cry now.
Elise,"Because that sounds-- I'm-- I need a minute. I need a minute, Sonic."
Sonic,"No, let it out. It's fine. Oh!"
Elise,Thank you..
Elise,"Thank you. Sonic: Oh, yeah, I mean.."
Sonic,"Yo, you gotta support your friends."
Shadow,(grunts) Silver: (whimpers)
Silver,Ow.. (whimpering) It hurts..
Shadow,Sewer system's a lot more intricate than I expected.
Duke,"Well, you better find it quick, because if we don't find it, we're not gonna be able to play Fortnite!"
Duke,I don't give a shit you better fucking fix it!
Duke,Wait..
Duke,What are you doing here!? Get out!
Shadow,What was that? Silver: I don't know. It sounded like yellow!
Shadow,I knew there was too much yellow in this world.
Shadow,"If I could do anything, I would eradicate 3 colors. Yellow, silver, and then silver again."
Silver,"Oh.. You meant me.. Shadow: No, no, not like you Silver, just like uh.."
Shadow,There's something about it like.. the person that silver kind of is.
Shadow,"Okay. Yeah. No, I don't like you Silver. What are you looking at?"
Silver,"This is really gross, but I can't look away. Ya know, it be like that sometimes."
Shadow,"Oh, God, it's like a pimple popping video."
Silver,(whimpers) I hate those.
Shadow,"Oh, God, I know that coughing."
Silver,"Oh, is it the weed? Is that what that is?"
Shadow,Close. It's my lover.
Duke,Take this. Protect my daughter from the gamers!
Duke,Take this gamer reflective stone.
Silver,I'll go check on the purple.
Shadow,"That's not weed, and you don't even look cool."
Duke,And now... I'll die.
Shadow,"Oh, God. Is that what I look like when I inevitably melt from over saturation of capital- capitalism?"
Shadow,I dunno. I guess that's where I'm going. I had a YouTube thing going.
Shadow,"Oh great emerald, tell me what I'm supposed to fucking do in this dub!"
Memphis,"Shadow, I'm trying to reform, help. Baby, help."
Shadow,"Oh, it's you! Memphis: I'm made of vape smoke babe, come on."
Shadow,"Oh, wait, he's made of- Wait, have you turned to vaping?"
Memphis,"Yeah babe, I'm made of purple jewel stuff. C'mon. Shadow: Is that really wise move?"
Shadow,"Well, I suppose this time, but you better cut that vaping out. Just kidding, you're getting thermosed baby!"
Memphis,"No, don't put me in your red face! No, don't vape me! Shadow: Get in the thermos. Get in the thermos."
Shadow,Get in the-- Get in! Get in the thermos. Get in the thermos! Get in!
Shadow,Pokéball that motherfuckin' vape!
Memphis,(moan)
Memphis,(wincing moan)
Shadow,Now I carry around my boyfriend wherever I desire.
Shadow,And what do you know? The perfect shape.
Silver,(whining)
Silver,"I leave for five minutes, and this happens?!"
Duke,"You've got to take care of the-- take care of the explosion, or we'll all die."
Duke,"You have a high five on your forehead, that means you are an epic gamer."
Duke,I'm going to take my daughter away so that way we can't die.
Duke,"Sweetie, remember, listen. Silver: Don't go toward it! What's wrong with you?"
Duke,Don't-- ...Shut up. I'm gonna resurrect her right now. Baby take the gamer gems.
Silver,Wha? Cool! Duke: I can't believe this..
Duke,By the power of gaming..
Duke,"I fucking live, and so will my daughter."
Duke,"Now, gamers, unite! Bring back my daughter!"
Duke,It worked! Oh my God!
Duke,(choked crying) Wait. Wait. The gamer piss. It killed her!
Duke,(while crying) No! Elise!
Duke,(overdramatic crying) The gamers..
Duke,"Silver... Take her to E3, and see the-- Silver: I don't think I can carry her."
Silver,Oh! She's very heavy. I'm not strong. Duke: Silver. Silver.
Duke,Just think about where you were before you--
Silver,I-- Where I was everything was on fire..
Duke,(shudders) My baby girl gamer...
Duke,You'll find your peace in another-- (choking crying)
Silver,This seems really private. I feel like I shouldn't be here for this.
Duke,(while choking) Shut the fuck up. I'm talking to my my daughter.
Duke,(sniffing and crying) Okay...
Silver,My arms hurt. Duke: Thank you so much...
Duke,"Your hair looks like ketchup, and you have the pale face of mayonnaise, but you will live."
Duke,I know you will.
Silver,"If you don't wrap it up, I'm gonna drop her. This, uh, it really hurts. Duke: Goodbye.. My ba--"
Silver,Okay. I just gotta... Urgh... Oh God.
Silver,"(struggling) Hold on... girl, I... I'll just... carry... you... Aargh--"
Silver,(whining panting) Shadow: Hey.
Silver,(whining crying) I can't.. feel my arms!
Shadow,"I see you got yourself somebody. Not like romantically, because that'd be weird. Silver: (crying) It hurts! Oh no.."
Silver,(crying) Oh no! Where do I put this girl!?
Silver,"(crying, sighs of relief) Shadow: Oh, mood."
Silver,(sighing) Finally.. (exhausted panting) Oh my God..
Shadow,"What do you think, boo? Memphis: I think you should let me out of your fucking vaper, babe."
Shadow,"Hm... Hey, think she likes vaping?"
Memphis,"No, she's like 11. Silver: No, that's... I don't think that's--"
Shadow,"I think we should let her vape. Give her the freedom to vape. All living things deserve freedom, Sliver."
Shadow,"Freedom to weed, to vape, to Fortnite. That's what we're all tying into, I think."
Shadow,That's a central message. Silver: I only know one of those is...
Silver,Can you carry me--? Shadow: No.
Silver,Oh... okay...
Elise,(tired groans)
Silver,How did she sleep through all of that?
Silver,Well whatever. I wish I could sleep. Bye.
Random Citizen,"Oh my God, there's a ship in the sky!"
Random Citizen,Ice cream ship!~
Random Citizen,Is Todd Howard driving an ice cream truck?
Amy,"Oh fuck! That's where I put my dildo! Aw dammit! Aw shit, I gotta go tell Sonic! Fuuuuuuu--"
Royal Staff,Uh ma'am? Uh ma'am? Ma'am? Ma'am--
Elise,"I've been told how to think about the ocean when I'm stressed, and I'm looking at that, and I'm real stressed."
Elise,I'm just gonna go meditate. I'mma think of the ocean..
Elise,Bye guys. I'm a peacin' out. I'll let you deal with this.
Royal Staff,Ma'am you're the ruler of this kingdom! You have to act!
Silver,"Ugh... Oh, now my legs hurt. Everything--"
Blaze,Oh.
Silver,"Blaze, help me. Everything hurts."
Blaze,"So, do you have fun on your little adventures?"
Silver,No! I didn't!
Silver,I didn't have fun at all. My eyeliners ruined. My arms hurt.
Silver,"I got kicked in the head. I hate everything, and I didn't even know I could do that. I'm usually just sad."
Blaze,"That's okay, baby. I know you're lost without me. Be sure never to leave my side again, okay?"
Silver,Okay...
Omega,"Take that. And that! You motherfucker! You steal Shadow away from me, I take your fucking skull! You motherfucking bitch!"
Memphis,"Yo, you chill the hell out dude, I'm too high for this."
Memphis,"All right, anyway, uh..."
Memphis,This is the last time I try to have bots play on my Fortnite server.
Omega,You are nothing but a Fortnite PR fake and a actual diamond accessory.
Memphis,What the fuck does that even mean? Those string of words just absolutely mean nonsense to me.
Memphis,You are so far below me you lowly little trash can man.
Omega,You are nothing but a fake game writer. You will never find happiness you PIECE OF SHIIIIIIIT! (gunfire)
Memphis,Ow! Dickhead! What the fuck!? I'm gonna lay down. I need a second after that. Jesus lord..
Memphis,"Ugh, I'm turning into vape juice, no-!"
Omega,"Shadow, my baby. I am so sorry."
Omega,I had to get rid of him because he was gonna get rid of everything. Also does Rouge have more weed? 'Cause I need that weed.
Omega,My fucking system modules were breaking. My DD4R was breaking on the inside. But I really love you Shadow.
Shadow,"Look, I don't know what your DDR machine is but--"
Shadow,That was an amazing dance!
Rouge,It was so good. You're an icon!
Rouge,You're gonna be more famous than Freddie Mercury!
Omega,I've been doing the JB block boy and b-boy dances all of my life. Also no one knows how to do the shuffle like I do.
Omega,"Listen Shadow, I'm gonna come out and just say it to you because.. my brain broken, and my heart knows what it desires."
Omega,Shadow. You are the one.
Shadow,"Wait, uh, Rouge do you hear something?"
Rouge,"Uh, only the sound of..."
Rouge,"I don't know. The ocean, I guess?"
Omega,Is this the friendzone?
Rouge,"Unfortunately, yes. This is what the friendzone feels like. Something I've felt more times than I care to say."
Shadow,"I don't know how to reciprocate against someone who's that amazing of a dancer but-- Listen we have more things to worry about right now, troupe."
Eggman,(evil snicker) Back in my lair once more.
Eggman,How many times are you gonna run? I've captured you 17 different times!
Elise,I feel like it's gonna be at least 18.
Eggman,The caucasity of this bitch.
Eggman,You run and run. I am an alpha male gamer.
Eggman,She be like This asshole...
Eggman,"I love Fortnite. Without me, you wouldn't even exist! Without me, you wouldn't be able to contain the demon because of gaming!"
Eggman,"Look around you. Imagine... Dragons. Now imagine it. Gaming, on Fortnite BR."
Elise,"I'm imagining the ocean, because, I've established that when I don't want to be somewhere, that's what I think of."
Eggman,"Frank Ocean can't save you now, sweetheart."
Eggman,No one's coming for you. No one's after you. I know what your father wanted for you.
Eggman,"So you're gonna do this whether you like it or not. Now let me log on to my Epic Games account, and let's see what we can--"
Computer,Welcome to EpicGames.com. Beep. Computer room located.
