name,line
Elise,Hi! (giggling) Hi!
Elise,Oh my gosh... you guys are too much!
Elise,"Wow, this fire is so bright and beautiful. I can't stop looking at it. Woah."
Elise,It's like it's spinning within me.
Elise,"Oh shit, that's outsi... outside of me. Okay. Yes. I'm good!"
Priest,"Princess, you had a That's So Raven vision once more."
Elise,"Oh no, I just day-dreamed. I'm here—for the people."
Priest,"Alright, well, let's get litty in this bitch. (Hayley laughs) Light that bitch up right now."
Elise,"I will light this bitch up, right now."
Priest,"Thank you, Princess. We're gonna get higher than a kite tonight!"
Elise,"It's lit, fam."
Chase,"Oh man, I hope somebody fucks up the fireworks."
Elise,Thanks guys~ Ah!
Robots,We are the robots! Please freeze. There's too much weight. Please freeze! Please freeze!
Robot,Am I doing this right? It's my first day on the job. Please freeze. Hello.
Eggman,"(ugly chuckles) Why, hello there, young princess. Do you like my outfit, my four nipples? (gestures to his outfit) Now — you must acquire me by getting on this boat right now! Not the boat— my ship!"
Eggman,"Gimme this— (gasps) You have the Chaos Emerald! In your hands! Gimme that shit right now, or I'm gonna rip it off you my goddamn self; give it to me!"
Elise,"Uh, how about no? Hehe."
Eggman,Oh. You'd rather do this the hard way.
Eggman,"Well, then it looks like we're gonna- Wait, those aren't tornadoes, this isn't Arizona! What's happening?!"
Sonic,My! That's a pretty snazzy performance there.
Silver,Eh?!
Sonic,HmMMmMm.
Eggman,Get that goddamn hedgehog!
Sonic,Hyah! I'm going down!
Robot,"Oh my God, he's an acrobat!"
Sonic,I'm gonna kill all of you! And... poke!
Robot,(anguished robot scream)
Sonic,"Oh, don't fall!"
Sonic,"HAHA, HA! ONE!"
Sonic,"Come on, Elise."
Eggman,"Sonic, where do you think you're going you motherfucking-- Oh! He's cockblocking me! Get him!"
Sonic,You're never gonna get me~!
Sonic,"Don't worry, Eggman's an egghead."
Eggman,What did you call me?!
Silver,"Oh, I should... uh... I-I guess he's got it handled. I'll just... I mean it'd be really awkward if I walked in now, so... (cast's wheezing laughter)"
Sonic,"Are you okay, princess? Whoa!"
Robots,"Kill em', we gotta kill em'. Stop!"
Sonic,"No, you can't kill anybody. Especially not me!"
Robot,"Oh my god, I have a family."
Robots,No! Ouch.
Sonic,Huh?! It sounds like you're getting taken away!
Eggman,"Yes, Sonic, I got 'cha bitch!"
Eggman,I got her in the palm of my hands!
Sonic,"Put her down, Eggman!"
Eggman,You put yourself down. I'm taking her and the Chaos Emeralds.
Elise,Take it!
Elise,Houee!
Sonic,"I'm gonna drop it, Elise, no! Oh, thank God. Okay, I'll rescue you. Don't worry."
Eggman,"No, you won't."
Sonic,I will!
Elise,"Take it, be good."
Eggman,"I'm taking her back to my ship and you'll never see her again, Sonic. You'll be dead. 10,000 years, Sonic! (screaming louder, but farther away) 10,000 years!"
Sonic,You won't even live for then— () ten thousand years.
Eggman,Then thousand years!
Sonic,Said the— Don't make fun of me!
Eggman,"Wow, Sonic, go read a book or something. See ya, idiot."
Sonic,"I can read very well, actually."
Sonic,"No! (grunts) Well, that smarts."
Eggman,Dumbass.
Shadow,HU-gh.
Shadow,"Dang robots— always taking my job of being bland. How'd I blow you up? How'd I blow YOU up? Ugh, I have some powers I need to kind of adjust to. Anyway— oh crap, light! Hey. Wristband. Tell me my future."
Wristband,It's me. The GUN soldier that's talking to you. Your future is: Undetermined.
Shadow,"Well, that's pretty lame. I spent like $20 on you. Anyway, I'm gonna break into— WHOA!"
Shadow,"Well, that was weird. Dematerializing, rematerializing. Anyway, Rouge, that's a nice purple you have there."
Rouge,"Thanks, it's uh, a good color on me. What do you think of my scepter?"
Shadow,I think it's nice. That's the purple I was referring to.
Rouge,Oh.
Shadow,"I mean, it matches your pink."
Rouge,Gotcha.
Shadow,Good.
Rouge,What's happening?
Shadow,"It's an earthquake, Rouge. Like, honestly, didn't you learn about this in third grade?"
Robot,You're getting fucked.
Rouge,"Uh, I don't know what earthquakes are."
Shadow,(scoffs) Then you're gonna be no use against these earthquake robots.
Sonic,"Oh, hey Tails!"
Tails,Hey Sonic!
Sonic,Long time no see.
Tails,How's it goin'? You want to go get some ice cream?
Sonic,(distracted) Well...
Tails,I'm-- I'm really hungry for some ice cream. I could go for a sundae or something right now.
Sonic,Hmmm...
Tails,"I don't know, maybe... something with sprinkles."
Sonic,"I'll take one scoop, please!"
Tails,"Okay! Bye Sonic! I— Oh, okay. I can fly? What?"
Sonic,"Aw, missed him again. We always miss the ice cream airship, Tails!"
Tails,Aw man!
Tails,It dropped a feather. I didn't think airplanes had feathers.
Sonic,"What is this one, vanilla?"
Tails,I guess so. Bye!
Sonic,"Yummy, yummy in my tummy!"
Shadow,"Oh crap. Rays. Well, fortunately we made here to the computer room. Hey— hey Rouge. Hey Rouge, hey Rouge."
Rouge,Yeah.
Shadow,We found— we— we found the computer room.
Rouge,"Oh fuck, the computer room. We could play so much Fortnite in here, dude."
Shadow,Are you kidding?
Rouge,Just think of all the Fortnite battles we could win in this room with this much technology. We'd be unstoppable.
Shadow,That's lame. Listen.
Shadow,"I appreciate the effort, but the new rage is Doki Doki Literature Club battle royale."
Rouge,Ohhh. I never heard about that one. Ohhh. I never heard about that one.
Shadow,"That's the new Monika re-design. She's like a redhead... even though she was, like, kinda brunette? I don't know. I didn't play Doki Doki."
Rouge,"I've not heard about that one yet, what's it about? How does it work? It sounds like a fun game. But, I mean, my favorite game is-is Fortnite, obviously. And this is a Fortnite update. This is a DLC I purchased. It's like an Amiibo."
Shadow,I'm so proud of you.
Rouge,Thank you! We're gonna go there.
Rouge,That's where we should— that's the island we should drop on right there.
Shadow,"So, this is the fabled Tilted Towers."
Shadow,"I could make a joke about that being the Battle Bus, but— (gasp)! It's you!"
Eggman,"(sinister laughter) I know where we're droppin' today, boys. (snickers)"
Rouge,"Eggman, how did you get here?"
Eggman,How do you think I get here? I floated down on my giant Battle Bus. (Mumbles and sings) The big air bus is comin! (normal speech) You know what I'm sayin'? It's Fortnite. How could you not know about Fortnite? You said you played. You were BatFucker69 on there.
Shadow,I haven't seen you since... The Incident.
Robots,BatFucker. BatFucker. BatFucker. BatFucker.
Eggman,"We don't talk about The Incident, Shadow. Now, DIE!"
Robot,I'll destroy you BatFucker!
Shadow,"Oh, Christ!"
Robot,It's been determined!
Rouge,AAaaaa!
Rouge,That's so mean!
Shadow,That's what you get for unironically having '69' in your name.
Shadow,HOH! Teriaaa!
Rouge,"Oh Shadow, you saved me!"
Eggman,"AHA! No, god! (finishes sentence while chuckling)"
Shadow,"Oh crap, the Purple's falling in a very long time!"
Rouge,No! Gimme the— get the purple! Oh no!
Robots,(repeatedly) Ow. Ow. Ow.
Robots,[unintellegable]
Robot,Instant ramen!
Shadow,So it's the power of Purple. I don't want to touch it.
Rouge,Did he break it?
Shadow,I don't kno— OH GOD
Memphis,(visceral screaming)
Rouge,Oh my god!
Eggman,"Oh no, the instant ramen's been released! We need to go, NOW."
Rouge,"Nooo, my Amiibo...."
Shadow,"A shadow. I feel like I should be able to feel with this guy, but.... I don't know. Something about it— AUGH!"
Shadow,"Going through the floor. Who do you think you are, Danny Phantom or something?"
Rouge,(gasps)
Shadow,My shadow... That's how I got my name!
Memphis,"(menacing laughter, followed by violent coughing)"
Shadow,"Oh d— dude, you alright?"
Memphis,(more violent coughing)
Shadow,You good? Good? You need a lozenge?
Rouge,"Oh my god, who the fuck is that?"
Shadow,Just let him have— just give him a second to clear his throat.
Memphis,(menacing laughter)
Memphis,Welcome to Tilted Towers.
Memphis,"Allow me to introduce myself. My name is Memphis, Tennessee, and I'm part lizard. Nice to— Yoroshiku egai-ishima, as they say in Nippon."
Shadow,Mee-Philes! I should've guessed. What happened to your mouth?
Memphis,"Oh, Shadow the Hedgehog, you don't know? There's a new trend going around online called kinning.My body is reforming to suit your own.oon I will be 100% Shadow, and there's nothing you can do to stop me. (villainous laughter)"
Shadow,"I can, um, kick your ass. Right now."
Memphis,"(Minecraft zombie growl) Let me get a good smell of you, little boy. (deep congested breathing)"
Shadow,No. Okay. You have to... gonna have to back up.
Memphis,"(snort laughs) Look at this orb. Inside you'll see the future. In your future, it looks like you'll kiss seven girls. How lucky for you. I learned this a few minutes ago."
Shadow,"Joke's on you! If you were a true copy of me, you'd know I'm gay."
Memphis,"Here, come to my house. C'mon, let's just go."
Rouge,Wha--!
Memphis,To my house.
Alfred,This game is AWFUL.
Blue,We just got fucking Thanos'd. What the shit?
Ryan,We just disappeared!
Silver,"Okay, so.."
Silver,Google Maps said the Denny's would be just around this corner. Denny's?
Silver,Augh! Get out.. of my way please!
Silver,Thank you!
Blaze,Silver!
Silver,Huh?
Blaze,Silver! The Denny's is that way.
Silver,"Finally, a Grand Slam!"
Silver,Let's go!
Blaze,"Save a cheese melt for me, Silver!"
Blaze,There it is: the Grand Slam! The Grandest Slam of them all -
Grand Slam,"It is I, the Grand Slam!"
Silver,I'm gonna savor every morsel of this. Let's go!
Grand Slam,You will not consume me. I will have both of your souls ingested in the G R A N D S L A M !
Blaze,...and then we ate it.
Silver,I can't believe we ate the who~ole thi~ng…
Blaze,"I know, I'm stuffed. I could use a nap, Silver."
Silver,"Well, I just always want to sleep, you know. I'm tired all the time. I hate it. 'Cause then when I try to go to sleep, I--I can't."
Blaze,"I know, and you angst so much about it."
Silver,"Ugh, I just wanna sleep, Blaze. I'm so tired of taking melatonin. It makes me tired all the time."
Blaze,"Oh, I fuckin' feel you there, buddy. Insomnia, am I right?"
Memphis,"Hey, gamers. Were you talking about Fortnite? No, I'm not even gonna pretend you were talking about Fortnite. I just really love bringing up my favorite game whenever I can."
Memphis,"I, too, have insomnia, but unlike you mine is not caused by depression."
Silver,"Hey, that's not– ...Well, yes, I am depressed. Okay."
Memphis,Mine is because I play so much Fortnite. I stay up late and go to Tilted Towers.
Memphis,"Welcome to my house. As you can see, I've knocked over many chairs because I get so tilted at the towers."
Silver,This isn't really tilted or a tower...
Memphis,"Well, you see, it's a gamer pad. Not many girls come in here cuz I get friendzoned so frequently. But that's okay."
Silver,I'd like to be in the friend zone. I'd like friends.
Memphis,It's not as pleasant as you'd think.
Memphis,They don't treat you like a friend. They treat you like an item.
Memphis,"Sometimes I wish I could be more than just an accessory to these women, but unfortunately, as a gamer, I don't get respect."
Silver,"Well, I'm not a gamer, so maybe they'll respect me!"
Memphis,That just makes you a beta cuck. That's-
Memphis,"That's the difference between you and I, Silver the Hedgehog. (resisting laughter) I'm a— I'm a alpha gamer f–"
Memphis,"Anyway... (laughs) where we— where we droppin', boys? These are all the new maps that they've added, and that's a newspaper."
Blaze,"Have you ever actually interacted with a woman in your life, Mephiles?"
Memphis,That doesn't matter. Check out this cool gem I got on eBay for $7.
Silver,It's so cool. Can I add it to my rock collection?
Sonic,OH! OH MY GOD!! SOMEONE HELP ME!!!
Silver,"Oh my god! That looked like it hurt. What do you think, Blaze?"
Silver,…Blaze?
Blaze,I didn't see it.
Memphis,Give me back my thing.
Memphis,"You see, I had to trap Sonic in the hell dimension 'cause he disrespected gamers."
Memphis,"If you-- If you still-- Anyway, welcome to my purple orb, it's time to go."
Silver,Wait... I don't... nugh!
Elise,Ughhh...
Elise,"Maybe if I-- if I keep thinking really hard, my hands will get clean."
Elise,"I really would like to eat, but there's-- huh?"
Sonic,"Elise! Elise: I really would like to eat, but there's-- huh?"
Elise,"I really would like to eat, but there's-- huh?"
Tails,Hi!
Elise,"H-How'd you get up here, guys?"
Sonic,"Nuh-uh! Oh! Elise: H-How'd you get up here, guys?"
Sonic,Nuh-uh! Oh!
Elise,I need a hug.
Sonic,"Your legs, are they okay? They look really sunburnt."
Elise,"Oh, well, you know…"
Sonic,"Yeah, I do."
Tails,"Oh no, look out!"
Eggman,I have you both-- all of you trapped here.
Eggman,"Now, you can either give her up and we play PUBG together OR..."
Eggman,"…you can stay down here and wrestle in your Fortnite, or whatever the kids are playing now."
Sonic,"PUBGs old news, Eggman!"
Tails,"Yeah, Eggman, you lame-o!"
Sonic,Tetris 99's where it's at!
Robot,NAAAANTS INGONYAMAAAA BAGITHI BABA
Sonic,"Hmm, robots in the sky!"
Tails,Robots in the sky? This is just like that dream I had once about robots in the sky.
Sonic,"Tell it to us in excruciating detail, Tails."
Tails,"Well, it was a whole dream! Bye!"
Ryan,"You fucking knew that was coming, you asshole."
Elise,Oh.
Sonic,You're heavy.
Rouge,Where the fuck are we?
Shadow,"This is the future that zoomers want, Rouge."
Shadow,This is the future of Fortnite.
Rouge,"No, this can't be the future of Fortnite. It's the best game of 2018."
Shadow,"Yeah, but this is like, 20, like, 99 or something."
Shadow,…like 99 tetri– Why is it black and white?
Rouge,I'm so confused. All my Fortnite save files are gone!
Shadow,We found the computer room!
Rouge,We found it! This is it. This is where we make our breakthrough. We're going to make a game.
Rouge,We're gonna combine all the battle royales and make a battle royale better than Fortnite ever was.
Rouge,"Come on. Shadow, you gotta be in this with me."
Shadow,You're right. And I know just the backing music.
Rouge,"Aaaand recording, go."
Shadow,(dooting the Pumpkin Hill theme)
Shadow,YES! The ultimate soundtrack for the ultimate game!
Rouge,Inspired! This is going to be the best game that's ever been made.
Rouge,"We're going to be rich, Shadow. Absolutely rich."
Rouge,All the gamers. All the gamers will be on our side.
Rouge,We'll have an army of gamers to take on the world with.
Shadow,"Y'know, you say that like it's a threatening thing, but have you ever seen a gamer in real life before?"
Rouge,"No, but they have-- they talk big shit."
Shadow,(gasp)
Rouge,What?
Shadow,"Sorry, I thought I heard a cat."
Rouge,"Oh, yeah."
Silver,Ah! Oh.
Silver,"Oh my gosh, this is- Is that what a... (♫ Mad World Instrumental ♫)"
Silver,Is that a rock too? Fuck yeah! This place rules!
Blaze,♪ All around me are familiar Blazes ♪
Blaze,♪ Worn-out Blazes ♪
Blaze,♪ Worn-out Blazes ♪
Blaze,Is that what a house looks like?
Blaze,Oh my god! This place is amazing!
Blaze,"Where am I, the future?"
Blaze,♪ Worn-out Blazes ♪
Blaze,Huh?
Blaze,I thought I heard a cat or something. I dunno.
Silver,"Oh my god, it's the guy on fire! But… he's not on fire? I gotta see what's up."
Amy,"Whoa, wait!"
Amy,"Where you goin', good lookin? Silver: No, I don't-- I don't like being touched!"
Amy,I'm gonna get all up in that crotch! Silver: Please stop! Please stop! Please-
Silver,"No, I hate this. I hate this. Please."
Amy,"You're not my boyfriend! Silver: Go away, please."
Amy,Get outta here! EEW!
Amy,Why would you touch me? Ew! Silver: Ugh! Oh my god!
Amy,EW! PERVERT!
Silver,This is the worst. This is the actual worst. Amy: Pervert! Pervert!
Silver,I wanna go home. I need-- no-- Amy: Pervert!
Silver,"Oh, and now blue guy's gone. This is-- this is-- that's just--"
Silver,My-- my whole good mood is ruined! I-I hope you're happy with yourself.
Amy,I am happy with myself! I have a positive mental attitude!
Silver,"God, I wish that were me."
Silver,"Anyway, go away!"
Amy,"You should just-- Silver: Anyway, go away!"
Amy,You should just cheer up!
Silver,No!
Amy,You can believe in yourself! Friendship!
Silver,Now you're just saying words.
Amy,Wait. Who are you?
Amy,Where are you-- No!
Silver,Hey! No! Let go! Please! Ah! You- Amy: Let go of my hand!
Elise,Ugh... Sonic: We did it!
Elise,"Uh… Thank you. Thanks, I appreciate that."
Elise,My legs are really tired from not walking though.
Elise,"You know how they, like--"
Sonic,"Oh, this? It's my arm."
Elise,Hands are so important.
Elise,When was the last time you washed your hands? I haven't washed mine in four days.
Elise,I've also been eating rocks. That's-- That's my go-to…
Sonic,Rocks?
Elise,…when I've been captured. Yeah!
Elise,"Yeah yeah yeah, they're pretty good. Sonic: Nuh-uh-uh! That's not food!"
Elise,What about grass?
Sonic,"This is food, Elise."
Elise,It's beautiful. I love your new hat.
Elise,I'm gonna name her… Alexa.
Sonic,You threw it away!
Sonic,"Bye, Alexa."
Elise,"Bye, Alexa."
Elise,"I hope she lives her best life, off in the sky."
Sonic,Me too.
Elise,She's gonna become a part of the sky. That's how it works.
Sonic,Come along with me!
Sonic,Why don't you tell me your incredibly complicated backstory...
Sonic,Complete with background visuals!
Elise,"Oh, okay. Yes. So once upon a time, I lived in a kingdom with my family,"
Elise,but the kingdom was on fire or maybe I dreamt it was on fire?
Elise,"Oh, yeah. I know I dreamt it. I dreamt it was on fire and there was a big monster-"
Elise,"Oh my gosh, the sky is so beautiful."
Elise,Eyes.
Elise,Look at the clouds. I saw a pig in the clouds. I just-- I-- But I don't know how.
Elise,It spoke to me.
Elise,It spoke to me like the fire monster.
Elise,"It said: That guy needs some mousse from his mustache, maybe a beard hydrator."
Sonic,I know where to find a mustache. Come on!
Elise,What?
Sonic,How was that?
Elise,"You know, it was all right, it wasn't great. Definitely won't recommend."
Sonic,One!
Elise,"Yeah, one."
Alfred,Oh my fucking god.
Alfred,(cackling)
Silver,"The battle royale game had a soundtrack that was so fire, it set fire to the world."
Silver,And now I need to find the hedgehog-- THERE HE IS!
Sonic,Huh? Who said that?
Sonic,Whoa!
Sonic,"Hold on, I think there's a fan."
Silver,"You must never rap again, or else the world will be destroyed!"
Sonic,Have you even heard my mixtape? It's fire!
Sonic,"AAAAAAH! Silver: Oh, I'm gonna fire at you, into a wall!"
Elise,Um. Oh my gosh. Sonic: Look... I-- I won't rap again.
Sonic,"Okay, I'll do it, I'll throw it away, I promise."
Elise,Guys! Eggman: She's taken by the snap-crackle-pop!
Sonic,"Oh, there she goes."
Silver,You stop!
Sonic,Oh! Silver: Hey!
Silver,I'm not done talking to you!
Sonic,"Okay, what do you want?"
Silver,"First, I want you to apologize. I mean, I was in the middle of talking to you."
Amy,No!
Silver,"Amy? Wait, how do I know your name?"
Amy,I TOLD YOU my name!
Silver,Oh yeah.
Sonic,Ugh.
Sonic,"Thanks Amy, maybe you can feature on my next track."
Amy,Maybe I can feature on your next what?
Sonic,See you later.
Amy,"Aw dammit, I missed my opportunity on Sonic's next album!"
Amy,"It's your fault, Silver boy!"
Amy,"I'm gonna pluck you up, melt you down and make a fucking necklace!"
Silver,"Yeah, I probably deserve it."
Amy,"Oh wait, shit. You don't make this fun 'cause you're sad!"
Silver,I'm always sad. That's just my thing. I-- I'm sorry. I'm sad. I can't--
Silver,"That's just how I be, y'know."
Silver,"That's just how I be, y'know. Amy: Well now I just feel bad."
Amy,Well now I just feel bad. Dammit.
Amy,"Alright, well, I guess, like... We could talk about, like... Future?"
Sonic,Hey Knuckles! Tails: Hey Knuckles!
Knuckles,What up? I'm listening to my Game Boy.
Knuckles,It's got the bomb tunes on it. Check-- Check out my favorite tracks.
Sonic,"Oh, Super Mario Kart?"
Tails,Not Super Mario Kart...
Tails,"(gasps) Eggman?! Eggman: We have pictures of Mario, pictures of Luigi..."
Eggman,"We have pictures of Mario, pictures of Luigi..."
Eggman,"pictures of Princess Daisy, princess of Princess Peach."
Eggman,Did you know that the FitnessGram™ Pacer Test is only done for people who like gaming Minecraft?
Sonic,Interesting.
Knuckles,"Yeah, the remix is a little hard to fucking understand, crush."
Sonic,"Yeah, it sounds like Pumpkin Hill."
Tails,"Now, Knuckles, why would you listen to music on a Game Boy? That's not what a Game Boy is for."
Knuckles,"You're right, it's what a Switch is for."
Sonic,"Not gonna say what I said last time,"
Sonic,'cause that was weird. Alright!
Tails,"Wait, what?"
Knuckles,"Hey, don't take me anywhere--"
Knuckles,Aw fuck!
Hayley,"You have found the computer room. Sonic: Oh god, here we are!"
Tails,"Where are we? (gasps) Ryan: Shut up, Hayley!"
Sonic,Eggman! Tails: Eggman!
Eggman,Welcome to the realm.
Eggman,"Now, I have the epic gamer right here!"
Elise,Hey! Sonic: No!
Eggman,Not the time to drop!
Eggman,"Now, I'm gonna be turning you all into Minecraft PS4s."
Sonic,"But Eggman, she's my heart and soul!"
Eggman,"Give me the gem right now! Sonic: But Eggman, she's my heart and soul!"
Eggman,Give me the gem right now!
Elise,No! Eggman: Give me the gem right now!
Eggman,I don't wanna hear your musky mouth. Put the gem there or I'm gonna put her in Minecraft.
Sonic,Alright.
Elise,"Sonic, don't do it!"
Sonic,Time to give up my 1-up.
Eggman,"That's right. I want that Aquafina, bitch. (slurp) I wanna sip that shit. YES!"
Sonic,WHOA!
Knuckles,üüüüüüü
Tails,Oh no! Knuckles: üüüüüüü
Eggman,"Enjoy your time in Fortnite, boys!"
Sonic,No!
Tails,No!
Sonic,"Wait, is it Fortnite or Minecraft?"
Eggman,"That's for really knowing you to find out, you goddamn nasty hedgehog son of a bitch."
Eggman,I want you gone out of my life.
Eggman,"Look at the size of my nostril, I can smell you from here!"
Elise,Why are you so rude?
Eggman,"Why are you so goddamn pale? Now, get the fuck away from me!"
Eggman,"GET OUTTA MY LIFE, SONIIIIIIIIIIIIIIIIIIC!!!!"
Tails,"Sonic, no! Aaaaah!"
Knuckles,"Eggman, I fucked your wiiiiife!"
Elise,No!
Eggman,I flushed them down the terlet.
Eggman,They'll be seen again.
Eggman,"Now, about those PUBG let's plays, we can start something tonight on twitchtv.com."
Eggman,"Wait, listen, I think we should maybe-- No, not even-- Not even PUBG. We'll go with Fortnite."
Eggman,We'll do Fortnite. We'll create Fortnite. And we'll get Todd Howard on it.
Eggman,"That way, he can make Fallout 76 battle royale."
Eggman,"Then, we have to switch over our plans."
Eggman,"That way, we create the ultimate battle royale experience. And I only need you for it."
Elise,So I'm just gonna let you keep talking and I'm just gonna meditate.
Eggman,"Now, listen, you're the key component!"
Eggman,And you listen to me. You will be my game tester. You'll test all of my battle royale experiences.
Eggman,All the gamers will look up to you. You will be gaming gamer girl queen.
Eggman,You'll have Cheeto Puffs on your fingers. And Twitch Prime will be mine!
Eggman,Now do you agree to do this… or am I gonna have to let you go on the terlet portal like those other ones did.
Elise,"To be honest, I've been visualizing a beach this whole time."
Elise,That's what my dad always told me to do when I was really stressed.
Knuckles,This isn't the beach!
Knuckles,Fuck!
Sonic,I feel like thinking about something but I don't know what.
Knuckles,"I can't think about anything, my brain is... schismed."
Sonic,"Yeah. You okay, Knuckles?"
Knuckles,"No, my corpus callosum is swollen."
Tails,My head's full of jellybeans…
Sonic,Sounds delicious.
Tails,Not really…
Shadow,You.
Sonic,Huh? I heard someone speak to me!
Rouge,"Well, hello boys."
Sonic,These towers are quite tilted.
Shadow,Yes. I tilted them myself.
Shadow,"See, we tried to make a game battle royale, but anyway--"
Tails,Look at this. You ruined everything! This is all your fault!
Knuckles,Shadow. You--
Knuckles,"Listen, you got any weed on you man? Like, since we're here--"
Shadow,"No, what are you the only one who smokes weed here, Knuckles?"
Rouge,Except for maybe Rouge. Rouge?
Sonic,Oh.
Sonic,"Speak for yourself, motherfucker!"
Shadow,"Listen, that's not important. Look!"
Sonic,I'll point at you also.
Shadow,"I'm not in the sky, dick nips."
Knuckles,"Hmm... So, dick nips, where are we going?"
Sonic,Huh? What's happening in here?
Silver,Uh...
Memphis,"As you can see, this is the optimum drop point."
Silver,Oh wait!
Memphis,"Wow, look at my orb, it's big and small!"
Sonic,"Oh, that orb looked big and small!"
Knuckles,…what the fuck?
Tails,Did you guys see that?
Sonic,What is this?
Tails,Where'd they go?
Tails,"Look, it's a big computer!"
Knuckles,…wait …what's on it?
Tails,Somebody's been playing Fortnite.
Knuckles,…aw fuck.
Tails,"Wait, no. Somebody's been building a video game. A battle royale that--"
Sonic,Oh sweet! I want to be the main character!
Shadow,Hmm… got a nice green glowy thing there?
Rouge,"It's weed, obviously."
Rouge,I was hiding it from Knuckles. He wanted it so bad. Did you see the look on his face?
Shadow,"Yes, I did, although it might be irradiated. So you might be slowly developing death."
Rouge,That's fine.
Omega,beep Rouge: That's fine.
Rouge,"We're all gonna die, anyway. What is that?"
Rouge,Looks like a weird cow or something.
Shadow,Looks like a robot that we can't possibly imagine what the voice could sound like.
Rouge,"Maybe if we, like, put weed in it we can make it work good."
Shadow,No.
Rouge,"You won't even try it? Just try my idea for once, Sonic! Uh, Shadow. Fuck."
Rouge,"Just listen to me, like, for once."
Rouge,I'm sorry that I'm bad with names.
Shadow,This is the last fucking time you confuse me with that blue asshole.
Shadow,"You did it once before, you did it again. You did it at our wedding, Rouge."
