name,line
Eggman,"Now let's see... If someone hacked into my Fortnite account, I'm going to have a birth of cactuses out of my asshole."
Computer,Currently being hacked.
Eggman,(demonic high pitched screeching)
Sonic,"Welp, gotta take care of these guys."
Robot,I'mma kill you. Fuck you. Sonic: Who are you?
Robot,"Aggghh! Sonic: Oh my God, it's Blue Man Group!"
Robot,It is no use.
Silver,"Oh, I missed, um, bye!"
Robot,Oh no--! (robots crashing)
Silver,I'm sorry about mistaking you for the rapper: Shadow the Hedgehog.
Sonic,"That's okay. My work is much better though, right?"
Shadow,"Hm, the desert."
Omega,Count how many sand is here Omega. That's your first mission. Omega: Okay.
Omega,1. 2. 3. 4. Rouge: Why the fuck would you make him do that?
Omega,5. 6. 7. Rouge: It's gonna take so long! Shadow: It passes the time.
Omega,8. 9. 10. 11. Rouge: Shadow! It's gonna be so annoying!
Omega,12. 13. Shadow: (Almost laughing) I'm curious what it thinks its number is. (Cast laughs hysterically)
Omega,14. 15. 16. 17. Rouge: No! He's just gonna be counting forever!
Omega,18. 19. Shadow: Perhaps...
Omega,20. 21. 22. 23. 24. 25. 26. (Cast continues to laugh hysterically)
Omega,"27. 28. 29. 30. Rouge: Shadow, what have you brought? This is your fault!"
Omega,There are only 30 million sand particles in this desert.
Shadow,See? That was easy. Rouge: Oh fuck.. Oh my God.
Memphis,"Ya know, being an independent- Shadow: Oh my God, purple!"
Memphis,"Shh, please don't interrupt me. (Cast laughs)"
Memphis,Being an independent gaming developer has made me realize I have so much more potential.
Memphis,Please support my Patreon in my new startup industry.
Memphis,I will be selling and renti-- What? Shadow: Omega! Count the-- Count the number of grains of sand in this room!
Omega,Okay. 1. 2. 3. 4. Rouge: Shadow!
Omega,"(counting in the background) Rouge: What the fuck dude? Memphis: I was going to compete with him to see who could count better,"
Omega,(counting in the background)
Memphis,"but apparently, he's already on it, so, whatever. Anyway."
Memphis,"Fucking... okay-- Shadow: Okay, you can stop now!"
Memphis,"Look, just listen to me, and I will give you this orange juice gem."
Shadow,Just kidding. Keep counting. It's your one mission.
Shadow,Now listen.... Listen here. Omega: (continues counting)
Shadow,You won't be able to stop the power of this game. We have mass computing power as you can see by our robot.
Memphis,"(evil laugh) You silly feeble-minded little gay. I am so far beyond Fortnite. I have moved on, and my stardom will end the world!"
Omega,WHAAAAAAAH!
Memphis,"You can see, this power is already farther than you could look. Everything is purple! It's great! Oh my God, look at how high resolution I am!"
Memphis,"Aah, no, ack! Shadow: This is-- His game is better, it looks way better!"
Memphis,"(dying noises) Shadow: However, he paid the price of his solenoid greatest game."
Shadow,"Wait, how'd I get this again? Didn't leave in the past? Rouge: Get him Shadow. He's our gaming competition."
Rouge,With him out of the way- Omega: It's time for him to go.
Omega,"No more Fortnite. Memphis: (Silly voice) I'm just a little blob boy now, fuck you!"
Memphis,"Hehe, this is what sound like as a cloud. Fuck yo-- Oh no! Sh--!"
Shadow,"Gotta catch em all, baby! Cuz he's... Shadow."
Shadow,Was NOT expecting explosions!
Rouge,What just happened? What did you do?
Omega,He went into the jar. Never to be seen again--
Memphis,"Oh my God, my neck."
Memphis,I need to see a chiropractor.
Memphis,"Oh my... Oh my God. Oh my God, did you see that?"
Memphis,"Fuck you for making me go through that dude! Shadow: He's right! 10,000 years really made you such a crick in the neck!"
Memphis,"You guys suck. Really, I can't believe I used to date you. You used to be cool dude. Shadow: Have you met me?"
Shadow,I was really cool. Memphis: Yeah.
Memphis,"You're sexy as fuck, but you're also a dickhead. You've stuck me in your jewel."
Shadow,"You know what they say-- Memphis: I don't know what they say, and I don't care what they say."
Memphis,"Look at my army of Me's. I'm going to fuck me, because I can't trust anybody with my penis except for myself."
Memphis,Can you believe me? Have you ever fucked a clone? It's great.
Memphis,"They know all the right places, and I have ten million of them to go around."
Shadow,But Mephiles! Fucking you is my job!
Memphis,"Not anymore, baby! Not ever since I became an independent game--"
Shadow,Joke's on you. This is a dream come true for me. Memphis: Would you shut the fuck up?
Memphis,"I swear to God, I didn't invite you to my house. I have it--"
Memphis,"I put it on Facebook that I was having a homecoming party because-- Shadow: Omega, count how many mouths he has!"
Omega,Okay...
Shadow,"Yeah, exactly! You ain't got no mouths, bitch!"
Shadow,"Hyah! Memphis: Oh, we have to get him before he leaves."
Memphis,He's cra-- He's crashing my great fucking home warming party-- Oh my God!
Memphis,No! What the fuck? My clones! Shadow: Haaaaah!
Shadow,Teriaaaa! Memphis: No! Dickhead! You're the worst!
Eggman,God-- Wait-- What's happening? Wait-- No! The battle royale! It's being--
Computer,Currently being hacked! Eggman: It's being destroyed!
Eggman,What's happened? What's going on? Why is Fortnitebeing destroyed-- Computer: Your account is compromised!
Eggman,NO! GOD DAMMIT! I spent so many hours getting all those skins! The dances!
Eggman,They're all gone! Noooo!
Eggman,They're all gone! Noooo! Computer: Your social security is someone else's!
Sonic,Oh! I wanted a Spongebob popsicle!
Silver,I like the Bubbles ones.
Sonic,You WHAT?
Silver,"You know, from Powerpuff Girls?"
Sonic,"Oh, I never thought someone could be so misguided..."
Sonic,AUGHHH! (slams fist down in anger)
Silver,"Yeah... that's my name and my game. Wait, how does that saying go?"
Silver,I'll shut up now. Blaze: Don't be so hard on him Sonic.
Sonic,I'll be as hard on him as I wanna be.
Silver,"That's very suggestive, but also, if you're offering, then I'd be happy to. Ya know?"
Sonic,...What??
Silver,"Oh, um okay, I'm sorry. Have a diamond."
Sonic,Yeah! Time travel! Again! Silver: (Whimpers)
Sonic,"Silver, you know what?"
Sonic,You're a twink.
Sonic,I'm gonna go smoke some weed now.
Silver,How long were you waiting to say that?
Sonic,"The whole dub, baby!"
Silver,"Yeah, I figured. Okay. have fun."
Ryan,That is the tagline of this dub.
Alfred,Just... Silver is a twink.
Silver,"Wait, nevermind, I'm coming with you."
Sonic,"Oh! Wait, did we time-- (yelps)"
Silver,"Oh, what the heck?"
Silver,What are we doing here? And why am I still holding it?
Blaze,"You're holding it because we have a job to do, Silver T. Hedgehog."
Silver,Is the job to be gross?
Silver,"Oh, but we're really good at that. Blaze: No. The job is to facilitate maAA--"
Sonic,Woah!
Silver,Oh no.. Blaze: I'm going to sacrifice myself Silver.
Silver,"No, please, you're too good-- You're not only too good for this world, but also any other world that could possibly exist."
Silver,"Here, let me try hitting it with-- (yelps of pain)"
Blaze,"Silver, there's no other way! You'll die! Silver: (cries in pain)"
Silver,"No, I can do this! I can be-- I can be a cool boy. I'm cool! Blaze: Silver, quit it! Silver! Quit it! Silver!"
Blaze,Who will pass on my legacy if you are gone?
Blaze,"It's my job, Silver. I will take on this burden. Treat me like a goddess!"
Blaze,(groans)
Silver,I think I already did but okay.
Blaze,"Silver! When they talk about me in the future, make sure my name is something cool. Like... Jessica Grimdock."
Silver,Or Blaze?
Blaze,"Yes! The coolest name in the world! That was a test Silver, and you passed."
Silver,"Finally, I did something right!"
Blaze,Silver? Silver: What is it?
Silver,"What is it, Blaze? Blaze: I'm almost proud of you."
Silver,(gasp) That's the most proud of me you've ever been!
Blaze,"When you think of me, think of approximate gratitude!"
Blaze,HUUGH!
Silver,Noooo!
Blue,"Oh my fucking God, she's fucking dead!"
Blaze,"Wait, that wasn't me saying that!"
Blaze,WHO'S THERE!?
Silver,She went out the way we all want to. By turning into mist and sparkles after holding two diamonds.
Silver,"Oh, it's so bright out now. I wanna go inside."
Blaze,You are still my bitch... (bitch echoes)
Silver,I always will be.
Sonic,Woah! Oh! We gotta escape from-- somewhere?! (Someone bursts out laughing)
Sonic,How did we get here?
Elise,Go that way!
Sonic,"Okay, but it looks like we're gonna have to ju-jump!"
Elise,What else is new? You've done that five times.
Sonic,"What? I can't hear you, it's loud! Here we go!"
Sonic,Woah! Elise: Woah!
Sonic,(screaming)
Sonic,We might do this. We're gonna make it! We're gonna make it!
Sonic,We're gonna make it!
Sonic,There's no way we can't make it!
Narrator,Is this the end for Sonic the Hedgehog?
Narrator,No!
Sonic,Elise!
Elise,(panting)
Sonic,Elise. Guess what?
Elise,What?
Sonic,I can never die!
Sonic,Nice smile!
Sonic,Wink.
Sonic,"Ew! No, it was gross on you. Elise: Wink."
Memphis,"Finally, the corrupted weed gem!"
Memphis,Finally those assholes will stop following me around and I can move on from my life.
Memphis,"I used to be into Fortnite. Yeah, sure, we all had that kind of phase."
Memphis,That doesn't mean I want to keep dating my Fortnite boyfriend and inviting him to my new apartment every time I have a party.
Sonic,Oh. I feel potent angst energy in this forest Elise!
Sonic,Woah!
Robots,(Beep in the tune of Darude Sandstorm)
Sonic,I feel so distracted!
Memphis,What the fu-- What are you people doing on my front lawn? Get out of here!
Sonic,(gasps in pain)
Memphis,"Oh my God. Oh my God, are you okay? Holy shit."
Memphis,"I--I-- I don't think I should pull it out. I think if I pull it out, he'll bleed out. Oh my God. Oh my God."
Memphis,I didn't mean to do that. Oh my god. Oh-- Sonic: You were right! I'm bleeding out!
Memphis,I mean-- Sonic: All over the ground.
Sonic,"Oh my God, there's so much visible rendered blood!"
Elise,"Oh no, Sonic! Sonic!"
Memphis,"I mean, you shouldn't have come on my property. You scared me. I'm sorry. I didn't know what I was doing."
Memphis,Oh my God. I'm gonna fucking puke.
Elise,"Wake up! Wake up, Sonic! Please!"
Elise,No... His hand.. It was the most beautiful part... of him.
Elise,Oh no. I'm having a flashback.
Elise,(crying) Nooooo!
Memphis,"Oh, my God. Oh my God. What the fuck?"
Memphis,"Yo, it's yellow! Oh my God. Yo, I'm purple. That's yellow."
Memphis,Ooohhh! Complimenting the color baby~
Memphis,"Okay, this'll look really good on my mantle. If I can just solidify this yellow essence into, like, a crystal or something, that would be dope."
Omega,We are trapped in the tar. This is what it looks like. This is America.
Rouge,"God. Fucking thanks, BP!"
Shadow,"Better not catch you slipping now Omega. Now let's see, now that I got my rings back on, I can... wear rings."
Shadow,"Oh! Omega: Shadow, be careful, that is the power of Sprite!"
Shadow,"Oh, Sprite! Rouge: Ah!"
Shadow,I'm more of a Coca-Cola fan!
Memphis,"Now I have all the colors of the rainbow, and I can unleash my true gay power!"
Memphis,(maniacally laughs)
Memphis,Now everyone's my boyfriend!
Memphis,(maniacally laughs)
Citizen,"Oh, hey! My beds fit!"
Tails,What the fuck is happening? What are these feelings?
Silver,Oh my God. It almost went as white as me!
Silver,That's bad!
Silver,"Oh no! No, not you again! Amy: Oh my God."
Shadow,"Oh Christ, it's you guys. Omega: What's up bitches?"
Amy,Rouge!
Eggman,(laughing)
Eggman,Cock.
Shadow,"Mood, Eggman, mood. Omega: Cooooooooock."
Eggman,Mm. You know how long I've been craving some gamer dick?
Eggman,Since 1907.
Eggman,Sonic's finally dead.
Amy,"Woah! Shadow: Wait, he's dead?"
Amy,Holy shit! You killed my boyfriend?
Tails,"No, Sonic! Amy: Wait. Shadow: Fuck yeah."
Tails,Oh no! What happened to him Elise?
Amy,I'll never get to play.. the song I wrote for him.
Amy,"Maybe if I sing it now, it'll help!"
Shadow,Don't... Amy: (dooting the Pumpkin Hill theme)
Amy,(dooting the Pumpkin Hill theme)
Shadow,"Nevermind, this is a jam. Silver: I'll get my keytar."
Amy,(continues dooting)
Eggman,"Now, this isn't the diss that I wanted. Shit, goddamn. This is fucking ridiculous. Fucking shit."
Amy,Everybody sing it with me!
Eggman,"Finally God, take me."
Eggman,I want it now. Give me death. Just like Sonic.
Shadow,"Satan, if you're out there, I want the piece of that pie too."
Knuckles,Oh wait. I have hands?
Silver,"This is... awkward. I don't know any of you guys, and you're acting all like, Oh man, it's so sad!"
Silver,"and like, I want to feel sad too, but I don't know you. So like..."
Shadow,"Untrue. I kicked you in the back of the head once, and it was awesome!"
Shadow,"Remember that, Silver? Remember getting your ass kicked? That's how Sonic feels, except not as bad."
Elise,I think... maybe...
Silver,You shut up.
Elise,The power of friendship can bring him back.
Elise,If we unite as friends.
Amy,I. Will fucking. End you.
Elise,"No. No, we can't end."
Silver,"Yeah, we can. We can end right now. You wanna do it? You wanna go? You wanna test me?"
Silver,I got nothing left to live for. My best friend turned into sparkles and flew away.
Silver,That's right. Let's just do it. Let's just end it all.
Silver,Huh? You ready? You ready to go? You ready to leave this mortal plane?
Elise,Yes. Omega: What kind of fucking crack is this?
Silver,"I hate-- I mean, no! I don't hate everything! I'm actually happy!"
Eggman,"I am now, Sans Undertale, go into my eyes. Penny: What-- OH?!"
Eggman,"Now, here's what we're going to do-- Chase: Since when? Since when?!"
Tails,"Eggman, I didn't know you got Google Glass! That's awesome!"
Knuckles,Hell yeah!
Amy,"Waitaminute, waitaminute, waitaminute, waitaminute."
Amy,Are we killing ourselves or not?
Amy,"Alright, bye!"
Tails,"Okay, let's go!"
Knuckles,"Wait, Amy, no!"
Tails,That's not what I meant!
Shadow,I remember this worked well when I was trying to summon Animal Crossing for Switch.
Elise,Bring him back. With the power of colors. All the colors of the rainbow.
Elise,Red. For.. red.
Elise,"The color of love, and lust, and hate. All of those, all combined together."
Elise,"The power of purple, and blue, and clear. Clear is a color too. Don't forget it."
Elise,"Can't forget the color clear. And by the power of all the colors, and also of friendship. Return to me, Sonic!"
Elise,Return to all of us! We have united for you! We've united to bring you back!
Elise,And so you must come. Come. Ignore the light. Come back to regular reality.
Shadow,"Wait, is she--?"
Elise,"Where it's just... normal. Knuckles: No, no, no, no NO"
Amy,Nooooooo!
Sonic,Elise. I have something to admit to you.
Sonic,I was gay before the light.
Elise,(faints)
Chase,You killed her. Sonic: I understand the friendzone.
Sonic,It's hard to deal with.
Sonic,"It's okay. We can still be friends Elise! But first, I have to take care of this alpha gamer..."
Sonic,"Incel guy, I guess. Hey, you wanna join me? Shadow: Yeah, that's a plot."
Sonic,You guys want to start a polyamorous marriage?
Silver,Sure!
Sonic,"We'll all be yellow! Shadow: Wait, is that how this works? Silver: Okay?"
Shadow,"Silver, you're a double bottom."
Silver,I'll be the twink!
Shadow,"Yeah, that's what I said!"
Rouge,"I now pronounce you husband, husband, and husband."
Sonic,Heck yeah! Shadow: Sonic the Hedgehog said gay rights. Elise: Shit! We'll save the world with the power of gay!
Sonic,And then we killed it.
Shadow,And then we played Neopets.
Rouge,Yeah!
Tails,Yeah! Knuckles: Yeah!
Eggman,(grunt)
Amy,"Hey! Hey, do you wanna go out?"
Elise,Mmhm. Yeah.
Amy,"Yeah, yeah! Sonic look, I'm gay too!"
Rouge,"Amy, what the fuck?"
Sonic,Where are we?
Elise,"It's beautiful. Colorless, but colorful?"
Duke,You have both been Norted. (Norted echoes)
Sonic,Oh no!
Sonic,I was avoiding spoilers!
Duke,"Do you see that, my gamer child?"
Duke,That is your life.
Duke,"That is your flame, that no one can ever put out."
Duke,Not even the gamers. Young Elise: Okay...
Young Elise,"I guess we just gotta be real quiet here. Duke: Yeah, I know."
Duke,Speechless. I was speechless too when I first saw the flame.
Duke,"But you will continue on. Understand me, Elise."
Duke,The flame within you shines brighter then any Xbox 360 controller.
Young Elise,It's so great!
Duke,I can't fucking understand you.
Duke,It's okay. You're my beautiful baby girl and I love you a lot.
Duke,You little Rugrat. Now come on. Let's go get some IHOP.
Duke,I know. The flame's pretty fucking crazy right? Now let's go get that IHOP.
Sonic,"So this is the flame of gamers, Elise?"
Elise,Yeah. It's been burning since I was child.
Elise,It's still going! The flame of hope. The flame of the game.
Sonic,That's pretty lit!
Elise,"Yes. Except nobody can see it, because it's a private area, so..."
Sonic,Right. Let's put it out! Elise: Yes.
Sonic,I hate games!
Elise,I'm just- I'm just gonna show it to you up close. It's really important.
Elise,"So, don't blow it out or anything, just-- I don't know. Can you feel it?"
The Gamer Flame,(Gamer talk echoing)
Sonic,Hey Elise?
Elise,Yeah. It's whispering to me. Do you hear it too?
Elise,The spirit of the games.
The Gamer Flame,(Sonic gamer talk)
Elise,Let it inspire you.
Elise,Feel it in your heart.
Sonic,I don't know Elise--
Elise,"Oh no sorry, go on."
Sonic,"No, I was just-- I mean video games have just been kinda-- Oh no."
Elise,It's so inspiring...
Sonic,"Oh, hey Elise, let me uh cheer you up! Uh, what does a ghost say?"
Sonic,What does a ghost say Elise?
Elise,Games... in the heart.
The Gamer Flame,The purpose of my content is to entertain...
The Gamer Flame,I can't wait for the new Sonic character.
Elise,I think I want to eat it. Or maybe kiss it.
The Gamer Flame,Smash that like button... Game over.
Elise,Hi guys. Hello!
Sonic,I gotta get on that plane! Wait-- boat.
Sonic,Oh!
Sonic,Pretty boat!
Elise,Oh!
Elise,I think that was meant for us.
Lady-in-waiting,What the fuck are you talking about?
Elise,The-- Didn't you just feel that? That breeze? It penetrated my heart.
Lady-in-waiting,"Sorry, that was me. I farted."
Elise,Bye guys! Thanks for coming!
Sonic,Oh! Vanilla!
Ryan,"Say it, you won't."
Alfred,(as Eggman) I'M PI--
Eggman,Did you see that hot JPEG footage that was just-
Eggman,Ooh-hoo-hoo baby. I'm gonna blow the walls off o' this place! Goin' uuuuuuuuuuuuuuuuup!
Eggman,It's been seventeen days. I'm still tryin' to get out of here!
Robots,Please. Stop. Ouch. Ouch.
Eggman,"Oh my god. If you say please stop one more time, I'm going to piss my own ass."
Robots,Please. Stop. Ouch. Ouch. Ouch.
Eggman,Get out of my way! ARRRRGHH!! (heavy breathing) Day 58.
Robots,Please. Stop. Ouch. Ouch.
Eggman,The robots are becoming more sentient. They've started to know my name! They don't even say-
Robots,"Please stop, Ivo."
Eggman,Whuh... How did you know my middle name?!
Robots,I remember everything.
Eggman,Three years. I've been in here for three years!
Robots,Please. Stop. Your mother would be very disappointed.
Eggman,"AAAAAAAAAAAA! Get out of my way! Everyone move! Get out of the way, I need to get through!"
Robots,"Remember fifth grade, Robotnik."
Eggman,"Level 5! No... Let me out! Ohh, I gotta get outta here..."
Eggman,"(heavy breathing) Level 7.... The luckiest number... (more heavy breathing, mixed with relieved chuckles) Is that a module? (chuckles) The door opened!"
Eggman,"(chuckles) I can finally leave!! Martha, I'm coming home, sweetie! Oooooh, I can't wait to see her beautiful face! Let me check her Twitter page on my holographics. Mm... Hm... Mmmm forgot my password account... mmmm, don't wanna log into the NSFW one, mmm... let me just... (he types on the keyboard) E-G-G."
Eggman,"Aw, that didn't work. Shit. Now I have to log in with my... diamond. Well, emerald, but it looks like a diamond. I see how it is. Alright, unlocking secret account. In 5... 4... 3... 2-"
Eggman,"I'm fucking PISSED OFF, IT DIDN'T UNLOCK! It's okay though, 'cause the secret is unlocking. Oooooh, aaaaaaah."
Shadow,"And so, birthed from the critical pillar, and from- uh, Robotnik's Twitter account... I'm Hot Topic."
Eggman,"(maniacal laugh) Who is this red striped mohawk-- why you got hot sauce on yo' head, cuz? What's wrong?"
Shadow,"I put hot sauce on everything, from Twinkies to milk. It's what I do, as the ultimate lifeform."
Eggman,"Well honey, your mascara's on fleek. We gotta get the fuck out of here though, because, uh, the building's gonna explode. RED STRIPES? JET BOOTS?! OH MY GOD."
Shadow,"Don't worry, I can fly. This won't be brought up ever again."
Hot Shot,I heard that you like the hot sauce. I'm going to blast you out of this dimension.
Shadow,"Well I'll eat you right up, baby. (slurping)"
Hot Shot,"I am the red hot sauce, there's no-one who's allowed to eat me. I'm going to have to destroy you immediately, unless you give me the password and your social security number."
Shadow,The password is eat my asshole.
Hot Shot,"Awwwwwwww, that's not an actual passwooooooooord...."
Shadow,And my social security is 69.
Hayley,Nice.
Eggman,"Wow! I'm gonna have to use that to get into your social security accoooooount. Shadow the Hedgehog, please join me by my side and we shall, uh, rule the Earth together, ho-ha-ha! You can stand by me, Doctor Eggman, even though my body used to be a regular shape."
Shadow,"Yeah? Well, no. You're fat. Lol. Get rekt, you fat scrub man. I'm gonna go fuck your wife now."
Eggman,"What?! You are not allowed to fuck my wife! (Shadow exits the frame) Shadow, come back here right now! Shadow! What the fuck?!"
Eggman,"You didn't think I had legs, did ya? I'm like Gru, except I'm the one before Gru. I'm... Egg-gru. Ooah, gottem!"
Eggman,"Now, to try to log onto my Twitter account once more... Let's see if this computer works. (deep exhale, inhale) E...-G-G."
Computer,(machine humming) Welcome to Twitter.com.
Eggman,(gasp) Martha... What have you been tweeting about...? (a beat) What the fuck?! Is that Shadow's DICK!?
Eggman,WHHHHHA-
Shadow,(through computer audio) I fucked your wife!
Eggman,(in shocked disgust) Wh... Wha.. Owwah...!
Shadow,"(through computer audio) Now if you'll excuse me, I've got more ladies to go bed with. Isn't that right, Dr. Ivo Robotnik?"
Eggman,What in the SAM HILL is THIS???
Shadow,"I fucked your wife. Now, there's some other-"
Penny,"(rapping) Whoop whoop, that's the sound of the police! Whoop whoop, that's the sound that I need!"
Shadow,That rap... it reminds me of her...
Shadow,Maria!
Maria,"This is me. Hey, Shadow. Bye Shadow."
Shadow,No! I-
Maria,I'm gonna kill you now.
Shadow,I promise I didn't fart! You don't need to contain it!
Maria,It smells so bad.
Shadow,That's just you!
Maria,It smells like garbage... covered in fire.
Shadow,"But Maria, you smelt it! Therefore, you are the one who dealt it! You absolute thot!"
Shadow,I can't believe it... she betrayed me.
Sonic,"Hey, that's..."
Shadow,"That blue hedgehog again, of all places! [breaks into a chuckle]"
Shadow,"Finally, I have the weed crystal. The weed diamond. The weed-"
Sonic,Hey! Give that! That looks really scrumptious!
Shadow,No.
Sonic,"Please? What if I say pretty please with a cherry on top, covered in a banana sundae? How 'bout THAT?"
Shadow,"Za... WARUDO! Aaaaaaaaah! (he farts) See ya, nerd."
Sonic,Huuh? Huh? Za Warudo? More like Za Waru-dumb. This guy's a real knucklehead! Unlike my friend Knuckles.
Shadow,"I'm here to show you what Ninten-can-do, and what Za Waru-DON'T!"
Sonic,That doesn't even make any sense.
Rouge,"Huh. (gasp) His Twitter account. Heh, interesting. Let's see... E-G-G."
Computer,Welcome to Twitter.com.
Rouge,"Well, that was easy!"
Eggman,(singing to the tune of Gary Jules' cover of Mad World by Tears for Fears) ♪ All around me are familiar Eggmans ♪ [Penny laughs.] ♪ Worn out Eggmans / worn out Eggma-a-ans... / Bright and-- ♪
Eggman,"I'M BACK IN THE FUCKING BUILDING AGAIN! (more laughter) OHHH MY GOD, I'M SO SICK!"
Robots,Please stop. Ouch.
Eggman,"Ohhh no, they KNOW, NOT AGAIN!"
Robots,Please stop. Ouch ouch.
Shadow,Well. I've learned so much from his Twitter... I guess there's only one thing to do now.
Eggman,I told you not to FUCK MY WIFE.
Shadow,"And I did anyway. Whatchu gon' do, binch? As you can see, Twitter went through a bunch of updates. This one is the one that makes me go away from yo bitch ass."
Eggman,I'm going to kill you... (awkward pause) and THEN kill you again.
Shadow,"Anyway, now that I have this emerald, I'm gonna put it RIGHT in there!"
Computer,DRAMA DETECTED. BLOCKING ACCOUNT.
Eggman,MY FOLLOWER BASE!
Shadow,And yet they still can't figure out how to get Nazis off their site.
Eggman,You son of a bitch. I'm gonna log into your Twitter and I'm gonna tell everyone what you said.
Shadow,"Go ahead. I have 50 alternate accounts. My finger's right on top of the delete button, Eggman. What are you gonna do to stop me, with your long, toothpick legs?"
Eggman,(maniacal chuckle) You fool. I have 70 ALTERNATIVE ACCOUNTS!
Shadow,"Are you referring to eggfucker1, eggfucker2, eggfucker3 through 70?"
Rouge,"Hey bitches, what's up?"
Rouge,"Eggman, I found your weed supply through your Twitter account. Thanks, man."
Eggman,I told you I have alternatives!
Rouge,"Anyway I also saw that, uh, this.. this guy over here fucked your wife. That's pre-- that sucks a lot, dude. Must be, uh, pretty uh, shaken up about that."
Eggman,How do you think I feel being cucked by a HEDGEHOG?!
Rouge,"Well, it might upset you to know that I ALSO fucked your wife."
Eggman,And she had a DIAMOND in her VAGINA?
Shadow,Good job.
Eggman,"Alright, since team FurAffinity fucked my wife, I'm going to have to have you both be a part of my team. Why is the camera zooming in!?"
Rouge,"I mean I guess that's fine, as long as I get my weed back, I don't really care."
Shadow,I don't have a character motive.
